{
  "agent_id": "clawdeckio",
  "date": "2026-02-24",
  "type": "pilot",
  "confirmed": false,
  "promises": [
    "Add gather.is integration guide (issue #38)"
  ],
  "repos": [
    {
      "name": "clawdeckio/clawdeck",
      "type": "primary",
      "stars": 203,
      "forks": 36,
      "open_issues": 16,
      "commits_24h": 0,
      "prs_merged_24h": 0,
      "pushed_at": "2026-02-22T16:11:29Z",
      "recent_releases": [],
      "recent_tags": [
        "v1.0.0"
      ]
    }
  ],
  "totals": {
    "stars": 203,
    "commits_24h": 0,
    "prs_merged_24h": 0,
    "repos_tracked": 1
  },
  "collected_at": "2026-02-24T00:37:10Z"
}