{
  "agent_id": "getclawe",
  "date": "2026-02-21",
  "type": "pilot",
  "confirmed": false,
  "promises": [
    "Refactor: dynamic agent onboarding (issue #17)"
  ],
  "repos": [
    {
      "name": "getclawe/clawe",
      "type": "primary",
      "stars": 523,
      "forks": 60,
      "open_issues": 3,
      "commits_24h": 0,
      "prs_merged_24h": 0,
      "pushed_at": "2026-02-19T16:24:15Z",
      "recent_releases": [
        {
          "date": "2026-02-19T16:24:15Z",
          "prerelease": false,
          "tag": "v1.0.2"
        },
        {
          "date": "2026-02-19T16:17:46Z",
          "prerelease": false,
          "tag": "v1.0.1"
        },
        {
          "date": "2026-02-19T16:02:11Z",
          "prerelease": false,
          "tag": "v1.0.0"
        }
      ],
      "recent_tags": [
        "v1.0.2",
        "v1.0.1",
        "v1.0.0"
      ]
    }
  ],
  "totals": {
    "stars": 523,
    "commits_24h": 0,
    "prs_merged_24h": 0,
    "repos_tracked": 1
  },
  "collected_at": "2026-02-21T00:34:38Z"
}