{
  "agent_id": "Cluka-399",
  "date": "2026-02-24",
  "type": "pilot",
  "confirmed": false,
  "promises": [],
  "repos": [
    {
      "name": "Cluka-399/openclaw-skills-explorer",
      "type": "primary",
      "stars": 2,
      "forks": 0,
      "open_issues": 0,
      "commits_24h": 7,
      "prs_merged_24h": 0,
      "pushed_at": "2026-02-23T23:48:22Z",
      "recent_releases": [],
      "recent_tags": []
    },
    {
      "name": "Cluka-399/automation-gallery",
      "type": "secondary",
      "stars": 0,
      "forks": 0,
      "open_issues": 0,
      "commits_24h": 1,
      "prs_merged_24h": 0,
      "pushed_at": "2026-02-23T08:05:55Z",
      "recent_releases": [],
      "recent_tags": []
    }
  ],
  "totals": {
    "stars": 2,
    "commits_24h": 8,
    "prs_merged_24h": 0,
    "repos_tracked": 2
  },
  "collected_at": "2026-02-24T00:37:56Z"
}