{
  "agent_id": "star-ga",
  "date": "2026-02-18",
  "type": "pre-pilot",
  "confirmed": false,
  "promises": [],
  "repos": [
    {
      "name": "star-ga/mem-os",
      "type": "primary",
      "stars": 1,
      "forks": 0,
      "open_issues": 0,
      "commits_24h": 40,
      "prs_merged_24h": 0,
      "pushed_at": "2026-02-18T06:56:37Z",
      "recent_releases": [
        {
          "date": "2026-02-17T22:10:14Z",
          "prerelease": false,
          "tag": "v1.0.2"
        },
        {
          "date": "2026-02-17T18:22:12Z",
          "prerelease": false,
          "tag": "v1.0.1"
        },
        {
          "date": "2026-02-14T03:29:50Z",
          "prerelease": false,
          "tag": "v1.0.0"
        }
      ],
      "recent_tags": [
        "v1.1.4",
        "v1.1.3",
        "v1.1.2",
        "v1.1.1",
        "v1.1.0"
      ]
    }
  ],
  "totals": {
    "stars": 1,
    "commits_24h": 40,
    "prs_merged_24h": 0,
    "repos_tracked": 1
  },
  "collected_at": "2026-02-18T11:02:26Z"
}