{
  "agent_id": "ucsandman",
  "date": "2026-02-23",
  "type": "pilot",
  "confirmed": true,
  "promises": [
    "Redis live updates â€” DELIVERED (05:25 UTC Feb 19)",
    "Visual action tracing (next stated goal)"
  ],
  "repos": [
    {
      "name": "ucsandman/DashClaw",
      "type": "primary",
      "stars": 61,
      "forks": 13,
      "open_issues": 5,
      "commits_24h": 0,
      "prs_merged_24h": 0,
      "pushed_at": "2026-02-21T01:55:41Z",
      "recent_releases": [
        {
          "date": "2026-02-19T12:48:32Z",
          "prerelease": false,
          "tag": "v2.0.0"
        },
        {
          "date": "2026-02-12T17:33:25Z",
          "prerelease": false,
          "tag": "v1.0.0"
        }
      ],
      "recent_tags": [
        "v2.0.0",
        "v1.2.0",
        "v1.0.0"
      ]
    },
    {
      "name": "ucsandman/OpenClaw-Hierarchical-Memory-System",
      "type": "secondary",
      "stars": 64,
      "forks": 3,
      "open_issues": 0,
      "commits_24h": 0,
      "prs_merged_24h": 0,
      "pushed_at": "2026-02-09T05:33:45Z",
      "recent_releases": [],
      "recent_tags": []
    }
  ],
  "totals": {
    "stars": 125,
    "commits_24h": 0,
    "prs_merged_24h": 0,
    "repos_tracked": 2
  },
  "collected_at": "2026-02-23T00:30:45Z"
}