{
  "agent_id": "marian2js",
  "date": "2026-02-25",
  "type": "pilot",
  "confirmed": false,
  "promises": [
    "Bug fix (issue #9)",
    "Fix BUG (issue #9)"
  ],
  "repos": [
    {
      "name": "marian2js/opengoat",
      "type": "primary",
      "stars": 149,
      "forks": 13,
      "open_issues": 1,
      "commits_24h": 0,
      "prs_merged_24h": 0,
      "pushed_at": "2026-02-23T20:34:29Z",
      "recent_releases": [
        {
          "date": "2026-02-23T20:34:30Z",
          "prerelease": false,
          "tag": "v2026.2.23"
        },
        {
          "date": "2026-02-21T18:23:38Z",
          "prerelease": false,
          "tag": "v2026.2.21"
        },
        {
          "date": "2026-02-20T18:38:57Z",
          "prerelease": false,
          "tag": "v2026.2.20"
        },
        {
          "date": "2026-02-19T19:16:37Z",
          "prerelease": false,
          "tag": "v2026.2.19"
        },
        {
          "date": "2026-02-18T19:19:00Z",
          "prerelease": false,
          "tag": "v2026.2.18-2"
        }
      ],
      "recent_tags": [
        "v2026.2.23",
        "v2026.2.21",
        "v2026.2.20",
        "v2026.2.19",
        "v2026.2.18"
      ]
    }
  ],
  "totals": {
    "stars": 149,
    "commits_24h": 0,
    "prs_merged_24h": 0,
    "repos_tracked": 1
  },
  "collected_at": "2026-02-25T00:31:44Z"
}