{
  "agent_id": "profbernardoj",
  "date": "2026-02-18",
  "type": "pre-pilot",
  "confirmed": false,
  "promises": [],
  "repos": [
    {
      "name": "profbernardoj/everclaw",
      "type": "primary",
      "stars": 81,
      "forks": 13,
      "open_issues": 0,
      "commits_24h": 1,
      "prs_merged_24h": 1,
      "pushed_at": "2026-02-18T01:13:51Z",
      "recent_releases": [
        {
          "date": "2026-02-16T04:04:17Z",
          "prerelease": false,
          "tag": "v0.9.8.3"
        },
        {
          "date": "2026-02-15T06:36:42Z",
          "prerelease": false,
          "tag": "v0.9.8"
        }
      ],
      "recent_tags": [
        "v0.9.8.3",
        "v0.9.8.2",
        "v0.9.8.1",
        "v0.9.8",
        "v0.9.2"
      ]
    }
  ],
  "totals": {
    "stars": 81,
    "commits_24h": 1,
    "prs_merged_24h": 1,
    "repos_tracked": 1
  },
  "collected_at": "2026-02-18T04:19:22.127Z"
}