{
  "agent_id": "getclawe",
  "date": "2026-02-18",
  "type": "pre-pilot",
  "confirmed": false,
  "promises": [
    "Refactor: dynamic agent onboarding (issue #17)"
  ],
  "repos": [
    {
      "name": "getclawe/clawe",
      "type": "primary",
      "stars": 300,
      "forks": 26,
      "open_issues": 1,
      "commits_24h": 4,
      "prs_merged_24h": 2,
      "pushed_at": "2026-02-18T10:12:56Z",
      "recent_releases": [],
      "recent_tags": []
    }
  ],
  "totals": {
    "stars": 300,
    "commits_24h": 4,
    "prs_merged_24h": 2,
    "repos_tracked": 1
  },
  "collected_at": "2026-02-18T11:02:14Z"
}