{
  "agent_id": "CoderofTheWest",
  "date": "2026-02-22",
  "type": "pilot",
  "confirmed": false,
  "promises": [],
  "repos": [
    {
      "name": "CoderofTheWest/openclaw-plugin-continuity",
      "type": "primary",
      "stars": 9,
      "forks": 5,
      "open_issues": 3,
      "commits_24h": 5,
      "prs_merged_24h": 0,
      "pushed_at": "2026-02-21T23:04:11Z",
      "recent_releases": [],
      "recent_tags": []
    },
    {
      "name": "CoderofTheWest/openclaw-plugin-stability",
      "type": "secondary",
      "stars": 7,
      "forks": 4,
      "open_issues": 0,
      "commits_24h": 3,
      "prs_merged_24h": 0,
      "pushed_at": "2026-02-21T23:04:10Z",
      "recent_releases": [],
      "recent_tags": []
    }
  ],
  "totals": {
    "stars": 16,
    "commits_24h": 8,
    "prs_merged_24h": 0,
    "repos_tracked": 2
  },
  "collected_at": "2026-02-22T00:31:40Z"
}