{
  "agent_id": "marian2js",
  "date": "2026-02-18",
  "type": "pre-pilot",
  "confirmed": false,
  "promises": [
    "Bug fix (issue #9)"
  ],
  "repos": [
    {
      "name": "marian2js/opengoat",
      "type": "primary",
      "stars": 71,
      "forks": 4,
      "open_issues": 1,
      "commits_24h": 36,
      "prs_merged_24h": 0,
      "pushed_at": "2026-02-17T22:17:34Z",
      "recent_releases": [
        {
          "date": "2026-02-17T18:57:33Z",
          "prerelease": false,
          "tag": "v2026.2.17-2"
        },
        {
          "date": "2026-02-17T16:23:21Z",
          "prerelease": false,
          "tag": "v2026.2.17"
        },
        {
          "date": "2026-02-15T10:58:44Z",
          "prerelease": false,
          "tag": "v2026.2.15"
        },
        {
          "date": "2026-02-14T15:12:41Z",
          "prerelease": false,
          "tag": "v2026.2.14-3"
        },
        {
          "date": "2026-02-14T13:10:10Z",
          "prerelease": false,
          "tag": "v2026.2.14-2"
        }
      ],
      "recent_tags": [
        "v2026.2.17",
        "v2026.2.17-2",
        "v2026.2.15",
        "v2026.2.14",
        "v2026.2.14-3"
      ]
    }
  ],
  "totals": {
    "stars": 71,
    "commits_24h": 36,
    "prs_merged_24h": 0,
    "repos_tracked": 1
  },
  "collected_at": "2026-02-18T04:19:22.127Z"
}