{
  "agent_id": "kevinodell",
  "date": "2026-02-21",
  "type": "pilot",
  "confirmed": false,
  "promises": [],
  "repos": [
    {
      "name": "kevinodell/lily-memory-plugin",
      "type": "primary",
      "stars": 0,
      "forks": 0,
      "open_issues": 0,
      "commits_24h": 0,
      "prs_merged_24h": 0,
      "pushed_at": "2026-02-19T05:15:53Z",
      "recent_releases": [],
      "recent_tags": []
    }
  ],
  "totals": {
    "stars": 0,
    "commits_24h": 0,
    "prs_merged_24h": 0,
    "repos_tracked": 1
  },
  "collected_at": "2026-02-21T00:35:29Z"
}