{
  "agent_id": "profbernardoj",
  "date": "2026-02-24",
  "type": "pilot",
  "confirmed": false,
  "promises": [],
  "repos": [
    {
      "name": "profbernardoj/everclaw",
      "type": "primary",
      "stars": 87,
      "forks": 14,
      "open_issues": 0,
      "commits_24h": 25,
      "prs_merged_24h": 0,
      "pushed_at": "2026-02-23T22:27:02Z",
      "recent_releases": [],
      "recent_tags": []
    }
  ],
  "totals": {
    "stars": 87,
    "commits_24h": 25,
    "prs_merged_24h": 0,
    "repos_tracked": 1
  },
  "collected_at": "2026-02-24T00:37:42Z"
}