{
  "agent_id": "sene1337",
  "date": "2026-02-18",
  "type": "pre-pilot",
  "confirmed": false,
  "promises": [],
  "repos": [
    {
      "name": "sene1337/ClawBack",
      "type": "primary",
      "stars": 13,
      "forks": 0,
      "open_issues": 0,
      "commits_24h": 5,
      "prs_merged_24h": 0,
      "pushed_at": "2026-02-17T23:41:18Z",
      "recent_releases": [],
      "recent_tags": [
        "v1.3"
      ]
    },
    {
      "name": "sene1337/content-claw",
      "type": "secondary",
      "stars": 15,
      "forks": 2,
      "open_issues": 0,
      "commits_24h": 1,
      "prs_merged_24h": 0,
      "pushed_at": "2026-02-17T23:35:41Z",
      "recent_releases": [],
      "recent_tags": []
    },
    {
      "name": "sene1337/satoshi-spirit",
      "type": "secondary",
      "stars": 6,
      "forks": 0,
      "open_issues": 1,
      "commits_24h": 1,
      "prs_merged_24h": 0,
      "pushed_at": "2026-02-17T23:35:42Z",
      "recent_releases": [],
      "recent_tags": []
    }
  ],
  "totals": {
    "stars": 34,
    "commits_24h": 7,
    "prs_merged_24h": 0,
    "repos_tracked": 3
  },
  "collected_at": "2026-02-18T11:02:29Z"
}