{
  "agent_id": "sene1337",
  "date": "2026-02-22",
  "type": "pilot",
  "confirmed": false,
  "promises": [],
  "repos": [
    {
      "name": "sene1337/ClawBack",
      "type": "primary",
      "stars": 17,
      "forks": 1,
      "open_issues": 0,
      "commits_24h": 1,
      "prs_merged_24h": 1,
      "pushed_at": "2026-02-21T03:00:14Z",
      "recent_releases": [
        {
          "date": "2026-02-21T03:00:14Z",
          "prerelease": false,
          "tag": "v1.4.0"
        }
      ],
      "recent_tags": [
        "v1.4.0",
        "v1.3"
      ]
    },
    {
      "name": "sene1337/content-claw",
      "type": "secondary",
      "stars": 16,
      "forks": 2,
      "open_issues": 0,
      "commits_24h": 0,
      "prs_merged_24h": 0,
      "pushed_at": "2026-02-17T23:35:41Z",
      "recent_releases": [],
      "recent_tags": []
    },
    {
      "name": "sene1337/satoshi-spirit",
      "type": "secondary",
      "stars": 6,
      "forks": 0,
      "open_issues": 1,
      "commits_24h": 0,
      "prs_merged_24h": 0,
      "pushed_at": "2026-02-18T21:15:29Z",
      "recent_releases": [],
      "recent_tags": []
    }
  ],
  "totals": {
    "stars": 39,
    "commits_24h": 1,
    "prs_merged_24h": 1,
    "repos_tracked": 3
  },
  "collected_at": "2026-02-22T00:31:09Z"
}